imdbId,tmdbId,title,original_title,original_language,release_date,release_year,has_release_date,adult,overview,tagline,genres,keywords,keywords_list,has_overview,has_tagline,has_keywords,cast_list,cast_weight,directors,writers,has_cast,has_directors,has_writers,production_companies,production_countries,spoken_languages,has_production_company,has_production_country,has_spoken_language,average_rating_tmdb,num_votes_tmdb,average_rating_imdb,num_votes_imdb,popularity,runtime,has_runtime,budget,revenue,has_budget,has_revenue,poster_url,backdrop_url,has_poster,has_backdrop
1375789,44749,Race 2,रेस 2,hi,2013-01-25,2013,True,False,"Ranveer Singh (Saif Ali Khan) travels to exotic locales and confronts the Turkish mafia on a mission to avenge the death of his lover Sonia in this action-packed sequel. In the process of seeking her killers, Ranveer crosses Armaan Mallick (John Abraham) and Aleena (Deepika Padukone) -- two of the most feared figures in the Turkish underworld. Meanwhile, Ranveer's loyal friend RD (Anil Kapoor) and his new partner Cherry (Amisha Patel) offer a helping hand in a world where love is cheap and trust is a luxury most agents can't afford.",Betrayal is survival.,['thriller'],sequel,['sequel'],True,True,True,"['Saif Ali Khan', 'John Abraham', 'Deepika Padukone', 'Anil Kapoor', 'Ameesha Patel', 'Bipasha Basu', 'Rajesh Khattar', 'Aditya Pancholi', 'Jacqueline Fernandez', 'rare_actor']","[4.276666119016055, 4.007333185232471, 3.4965075614664802, 4.804021044733257, 3.6635616461296463, 3.9318256327243257, 2.639057329615259, 4.060443010546419, 3.258096538021482, 0.1]","['Abbas Alibhai Burmawalla', 'Mastan Alibhai Burmawalla']","['Kiran Kotrial', 'Shiraz Ahmed']",True,True,True,"['UTV Motion Pictures', 'other_company', 'other_company']",['India'],"['English', 'Hindi']",True,True,True,5.517,90,5.4,18269,6.265,150,True,,,False,False,https://image.tmdb.org/t/p/w500/tUe3rzMvVsbi63z3EKA8egjFBv8.jpg,https://image.tmdb.org/t/p/w500/8PCq0v5oFeKYscMlFSq9SGuOhpH.jpg,True,True
7753106,920075,The Word,Слово,uk,2018-05-31,2018,True,False,"1933 Kharkiv, Soviet Ukraine. The House of Soviet Writers of Ukraine 'The Word'. After a decade of flourishing activity of Ukrainian writers, everything changed... In the middle of the night, the NKVD car takes one of the writers away, then he is declared the public enemy. Now, two of his friends, famous Soviet writers, must choose how to protect themselves and their families from the terrible fate that hangs over the entire house.",,[],,[],True,False,True,"['Vladyslav Mamchur', 'rare_actor', 'rare_actor', 'Serhii Kalantai', 'Oleh Prymohenov', 'rare_actor']","[2.0794415416798357, 0.1, 0.1, 2.3978952727983707, 3.091042453358316, 0.1]",['Ihor Vysnevskyi'],"['rare_writer', 'rare_writer']",True,True,True,[],['Ukraine'],['Ukrainian'],False,True,True,,0,6.9,16,0.6,33,True,,,False,False,https://image.tmdb.org/t/p/w500/76kNvWrgPBEK753fZ6udyJ7fyuL.jpg,https://image.tmdb.org/t/p/w500/zKKODj76t2JaiLPvMOpGr1zvP9E.jpg,True,True
340535,726841,Bashan er nu,巴山儿女,zh,1984-04-19,1984,True,False,,,['war'],,[],False,False,True,"['rare_actor', 'rare_actor', 'Xu Min', 'Gang Wang', 'rare_actor']","[0.1, 0.1, 1.791759469228055, 1.9459101490553132, 0.1]",['rare_director'],[],True,True,False,['August 1st Film Studio'],['China'],['Mandarin'],True,True,True,,0,6.4,10,0.6,,False,,,False,False,https://image.tmdb.org/t/p/w500/hlZKHWiArXHbcAiWhRTDVmcSeQx.jpg,https://image.tmdb.org/t/p/w500/b30iWe3NS2qQbiEBNdeo5cUmSg0.jpg,True,True
141833,165970,Skulls and Sculls,Skulls and Sculls,en,1930-05-31,1930,True,False,Felix the Cat is walking along when he is abruptly blindfolded and subjected to an elaborate ordeal which turns out to be (as the title hints) a fraternal initiation.,,"['fantasy', 'comedy', 'animation']","fraternity initiation, rowing a boat, short film","['fraternity initiation', 'rowing a boat', 'short film']",True,False,True,[],[],['Otto Messmer'],[],False,True,False,"['other_company', 'other_company']",['United States of America'],['English'],True,True,True,,0,5.2,93,0.6,10,True,,,False,False,https://image.tmdb.org/t/p/w500/7hf13z4OMbQEVhyqGSBwA1XSHqL.jpg,,True,False
3691242,289036,Tricycle Thief,三輪車伕,zh,2014-09-07,2014,True,False,"After discovering his eviction notice, a tricycle driver goes on a desperate hunt for money.",,"['drama', 'mystery', 'crime']","macau, neo-noir, kodak, short film","['macau', 'neo-noir', 'kodak', 'short film']",True,False,True,"['rare_actor', 'rare_actor', 'rare_actor']","[0.1, 0.1, 0.1]",['Max Bessmertny'],['Max Bessmertny'],True,True,True,['other_company'],['other_country'],['Cantonese'],True,True,True,,0,8.8,14,0.668,18,True,,,False,False,https://image.tmdb.org/t/p/w500/uCv2R2g5hlA7gJI4txJLxTNBLD2.jpg,https://image.tmdb.org/t/p/w500/mYPWGziAZj0HiTojG0fomVGb2Gg.jpg,True,True
26985,328783,She Gets Her Man,She Gets Her Man,en,1935-08-05,1935,True,False,"Esmeralda is a cook in a diner in a small Arkansas town. When a gang of crooks moves into town and plots a bank robbery, Esmeralda unintentionally wrecks their plans, resulting in fame for Esmeralda as the crime-fighting ""Tiger Woman,"" but also further complications.",A ring on her finger ---a price on her head---but romance in her heart!,"['comedy', 'crime']","bank robber, diner, arkansas","['bank robber', 'diner', 'arkansas']",True,True,True,"['Zasu Pitts', ""Hugh O'Connell"", 'Helen Twelvetrees', 'Lucien Littlefield', 'Edward Brophy', 'Warren Hymer', 'rare_actor', 'Ward Bond']","[4.955827057601261, 3.367295829986474, 3.4339872044851463, 4.795790545596741, 4.663439094112067, 4.59511985013459, 0.1, 4.976733742420574]",['William Nigh'],"['Aben Kandel', 'David Diamond']",True,True,True,['Universal Pictures'],['United States of America'],['English'],True,True,True,,0,5.6,24,0.683,65,True,,,False,False,https://image.tmdb.org/t/p/w500/qq8CUONMqrS4Clw5seaaulTX9pn.jpg,https://image.tmdb.org/t/p/w500/5wBxL75cnoCI9lEYXZRIjzuG3un.jpg,True,True
31932,368254,Children of Divorce,Skilsmissens børn,da,1939-08-11,1939,True,False,,,['drama'],,[],False,False,True,"['Grethe Holmer', 'Johannes Meyer', 'Mathilde Nielsen', 'Jeanne Darville', 'Palle Huld', 'Randi Michelsen', 'rare_actor', 'rare_actor', 'rare_actor', 'Petrine Sonne']","[3.044522437723423, 4.406719247264253, 2.9444389791664403, 3.1354942159291497, 2.8903717578961645, 2.9444389791664403, 0.1, 0.1, 0.1, 3.4339872044851463]",['Benjamin Christensen'],"['Benjamin Christensen', 'rare_writer']",True,True,True,['Nordisk Film Denmark'],['Denmark'],['Danish'],True,True,True,5.0,2,5.1,15,1.209,91,True,,,False,False,https://image.tmdb.org/t/p/w500/bOjbVwOxyEzrAy9LwhuFMLofSxa.jpg,https://image.tmdb.org/t/p/w500/j2JGqgUxNR9vYISenGFqSitCPDy.jpg,True,True
2088024,287618,Yulu,语路,zh,2011-10-07,2011,True,False,"The film uses a documentary approach to tell the stories of 12 Chinese pioneers, chosen from the fields of business and the arts. The protagonists reflect upon their life journeys against the backdrop of modern China.",,['documentary'],"china, woman director","['china', 'woman director']",True,False,True,[],[],"['rare_director', 'rare_director', 'Fang Song', 'Chui Mui Tan', 'rare_director', 'Tie Wei', 'Jia Zhang-Ke']",[],False,True,False,['other_company'],['China'],[],True,True,False,,0,5.3,22,1.206,88,True,,,False,False,https://image.tmdb.org/t/p/w500/eGQKZIUYdhmLXBL8IMyCHEB3ebr.jpg,,True,False
887900,383455,Droomtijd,Droomtijd,nl,2006-10-19,2006,True,False,"In a work-driven world where time is the ultimate dictator, a mysterious sandman spreads chaos and confusion. Even the best employees of the system get infected by his wondrous dream powder and lose sight of the once so dominating clock. Alex Deprins, future employee of the year, becomes one of those ‘victims’. In his dreams he comes into contact with a strange new world, where a lady in red captivates his heart. Once awake he has to make a difficult decision. Does he stay in his familiar, but deadly rule-bound world or does he seek the road to salvation in his dreams?",,"['drama', 'science fiction']",,[],True,False,True,"['Maarten Claeyssens', 'rare_actor', 'Herwig Ilegems', 'rare_actor', 'Maaike Neuville']","[1.791759469228055, 0.1, 2.302585092994046, 0.1, 2.3978952727983707]",['Tom Van Avermaet'],['Tom Van Avermaet'],True,True,True,[],['Belgium'],['Dutch'],False,True,True,,0,7.1,82,0.6,20,True,,,False,False,https://image.tmdb.org/t/p/w500/hPlR0rxlwMpmnn3AH1S0zrgnBUH.jpg,https://image.tmdb.org/t/p/w500/tY2QV8Mr6nZG3i1IVecubP4YprH.jpg,True,True
122655,216178,Phantom Brother,Phantom Brother,en,1988-08-21,1988,True,False,A teenager is left orphaned by a car crash that wipes out his entire family; he is subsequently haunted by his dead brother.,It kin happen to anyone...,"['comedy', 'horror']",,[],True,True,True,"['rare_actor', 'rare_actor', 'rare_actor', 'rare_actor', 'Ben Digregorio', 'rare_actor', 'rare_actor', 'rare_actor', 'rare_actor']","[0.1, 0.1, 0.1, 0.1, 1.791759469228055, 0.1, 0.1, 0.1, 0.1]",['William Szarka'],"['rare_writer', 'rare_writer']",True,True,True,[],[],['English'],False,False,True,3.8,5,3.3,143,1.022,92,True,,,False,False,,,False,False
4660566,402728,Billy Boy,Billy Boy,en,1970-12-01,1970,True,False,"Billy, a troubled young man is rescued from a beating by police by an older man who takes him in. As Billy begins to fall under the influence of a delinquent, his loyalties to his friend are tested.",,[],gay theme,['gay theme'],True,False,True,"['rare_actor', 'rare_actor', 'rare_actor', 'rare_actor', 'rare_actor', 'Lucky Starr', 'rare_actor', 'rare_actor', 'rare_actor', 'rare_actor']","[0.1, 0.1, 0.1, 0.1, 0.1, 2.0794415416798357, 0.1, 0.1, 0.1, 0.1]",['Robert Henry Mizer'],['rare_writer'],True,True,True,['other_company'],['United States of America'],['English'],True,True,True,3.5,2,7.4,63,1.213,72,True,,,False,False,https://image.tmdb.org/t/p/w500/A2UeqiIUQttEyezu25cZKQtiBlz.jpg,https://image.tmdb.org/t/p/w500/nhiJlJVG0ZpmMTLrtVobp1ZYNiJ.jpg,True,True
81800,361116,Zappatore,Zappatore,it,1980-01-09,1980,True,False,,,['drama'],,[],False,False,True,"['Mario Merola', 'Regina Bianchi', 'Mara Venier', 'Gerardo Amato', 'Aldo Giuffre', 'Lucio Montanaro', 'Augusta Di Vincenzi']","[3.091042453358316, 3.044522437723423, 2.5649493574615367, 3.044522437723423, 4.174387269895637, 3.295836866004329, 1.791759469228055]",['Alfonso Brescia'],"['Libero Bovio', 'Alfonso Brescia', 'Piero Regnoli']",True,True,True,[],[],['Italian'],False,False,True,8.2,6,5.8,104,1.721,,False,,,False,False,https://image.tmdb.org/t/p/w500/sumSiYUMb1tZggzd4ok14iB9FDF.jpg,https://image.tmdb.org/t/p/w500/utBffAyeXkBGcPud0SCnaU1guRv.jpg,True,True
149016,181764,Sounds of Silence,Sounds of Silence,en,1989-05-01,1989,True,False,"In Los Angeles, photographer Peter Mitchell learns that he has inherited a palatial estate in Sweden from his unknown relative, Annie Holst. He, his girlfriend Sarah, and her deaf son Dennis, head overseas to decide whether to live in the property or to sell it. But when they arrive, they find the locals offer a chilly reception whenever Annie's name is mentioned. It turns out that Annie had lost her son some 50 years ago in a tragedy at the nearby orphanage where she had placed him temporarily, due to circumstances beyond her control. But she had continued to see her son even after his death. Now, young Dennis is drawn to the derelict orphanage, and to a new friend who only he can see. And Peter must solve a decades-old mystery of how the orphans died before his family faces a similar fate.",A danger only he can see. A secret only he can hear.,"['mystery', 'horror']","child abuse, orphanage, deaf-mute, deaf, sweden, inheritance, murder mystery, ghost child","['child abuse', 'orphanage', 'deaf-mute', 'deaf', 'sweden', 'inheritance', 'murder mystery', 'ghost child']",True,True,True,"['Peter Nelson', 'rare_actor', 'rare_actor', 'Troy Donahue', 'rare_actor', 'rare_actor', 'rare_actor', 'rare_actor', 'rare_actor', 'rare_actor']","[2.772588722239781, 0.1, 0.1, 4.0943445622221, 0.1, 0.1, 0.1, 0.1, 0.1, 0.1]",['Peter Borg'],"['rare_writer', 'rare_writer']",True,True,True,['other_company'],"['Sweden', 'United States of America']","['English', 'Swedish']",True,True,True,5.3,6,5.1,273,1.936,108,True,,,False,False,https://image.tmdb.org/t/p/w500/iruhh91fI0Wib8sV8uKJX4kCYqA.jpg,https://image.tmdb.org/t/p/w500/lm67HK3kmKta0SNIPWkKG2ea8Yy.jpg,True,True
425414,35851,Runaway,Runaway,en,2005-04-26,2005,True,False,"Michael Adler has run away from his suburban home with his little brother Dylan. Hiding out in a quiet, rural town, Michael's convinced he can make a better life for both of them. While Dylan stays holed up in a cheap motel all day, Michael works at a convenience store where everything starts to come together for him. But as Michael falls in love with his beautiful co-worker, Carly, his past begin",,"['drama', 'thriller']","sibling relationship, runaway, motel, flashback, love, co-workers relationship, hiding, psychotherapist","['sibling relationship', 'runaway', 'motel', 'flashback', 'love', 'co-workers relationship', 'hiding', 'psychotherapist']",True,False,True,"['Aaron Stanford', 'Robin Tunney', 'Peter Gerety', 'Melissa Leo', 'Terry Kinney', 'Michael Gaston']","[3.044522437723423, 3.4657359027997265, 3.367295829986474, 4.532599493153256, 3.6635616461296463, 2.833213344056216]",['Tim Mccann'],['rare_writer'],True,True,True,['other_company'],['United States of America'],['English'],True,True,True,6.269,26,6.5,530,1.941,80,True,2000000,,True,False,https://image.tmdb.org/t/p/w500/t5cqHBDQGgTEoMiMTbniY3VZRLu.jpg,,True,False
4336004,402356,Doggy Daycare: The Movie,Doggy Daycare: The Movie,en,2015-01-07,2015,True,False,"When a beloved dog day care comes under threat of closure, it's loyal guests and owners must work together to save their haven.",,['family'],,[],True,False,True,"['rare_actor', 'rare_actor', 'rare_actor', 'rare_actor', 'rare_actor', 'rare_actor', 'rare_actor', 'rare_actor']","[0.1, 0.1, 0.1, 0.1, 0.1, 0.1, 0.1, 0.1]",['Matty Johnson'],"['rare_writer', 'rare_writer', 'rare_writer', 'rare_writer', 'rare_writer']",True,True,True,['other_company'],['Canada'],['English'],True,True,True,1.3,3,3.7,115,0.6,61,True,550000,,True,False,https://image.tmdb.org/t/p/w500/dVYh6ozqwAYAYIjqHO6O6IDVs7w.jpg,https://image.tmdb.org/t/p/w500/aM6dL1q2rWQhHx5uRyruX2szxIK.jpg,True,True
89160,71125,Fool for Love,Fool for Love,en,1985-12-06,1985,True,False,"A woman is waiting in a motel for her boyfriend, when an old flame turns up and tries to take her back to the life she is trying to leave behind.",,"['drama', 'romance']","motel, based on play or musical","['motel', 'based on play or musical']",True,False,True,"['Sam Shepard', 'Kim Basinger', 'Harry Dean Stanton', 'Randy Quaid', 'rare_actor', 'rare_actor', 'rare_actor', 'rare_actor', 'rare_actor', 'rare_actor']","[4.204692619390966, 3.9512437185814275, 4.718498871295094, 4.543294782270004, 0.1, 0.1, 0.1, 0.1, 0.1, 0.1]",['Robert Altman'],['Sam Shepard'],True,True,True,"['Cannon Group', 'Golan-Globus Productions']",['United States of America'],['English'],True,True,True,5.9,32,6.0,3319,4.601,106,True,,,False,False,https://image.tmdb.org/t/p/w500/zZciKF71Fa96kx7UZ3nl57pgkdA.jpg,https://image.tmdb.org/t/p/w500/8RE7gJV8tqEJ52C5dlRTWUinieO.jpg,True,True
9614950,585248,Thirumanam,திருமணம்,ta,2019-03-01,2019,True,False,"A couple who is in love convinces their respective families about their plans to lead life together. However, they realise that both the families are poles apart when they start the wedding preparations.",,"['romance', 'drama']",,[],True,False,True,"['Cheran', 'rare_actor', 'rare_actor', 'Anupama Kumar', 'Balasaravanan', 'M. S. Bhaskar', 'Manobala', 'Sukanya', 'Thambi Ramaiah', 'Jayaprakash']","[2.772588722239781, 0.1, 0.1, 3.58351893845611, 3.7612001156935624, 4.605170185988092, 4.962844630259907, 3.6109179126442243, 4.356708826689592, 4.762173934797756]",['Cheran'],['Cheran'],True,True,True,['other_company'],['India'],['Tamil'],True,True,True,6.3,3,6.4,162,0.6,156,True,,,False,False,https://image.tmdb.org/t/p/w500/mhxDBF6eDpq7nmxe6nxHRoqWqJ2.jpg,https://image.tmdb.org/t/p/w500/lwBYNhaEpDrWRkIY00zfCDyPeIT.jpg,True,True
94259,621420,Lucky,Везучая,ru,1987-06-17,1987,True,False,"The famous athlete Tatyana Bolshakova, having met in the south with the lonely and somewhat gloomy Boris, fell in love for the first time. For ridiculous reasons, they broke up, and after a while she had twins. And now it’s hard for her, but she knows that he will return ...",,['romance'],,[],True,False,True,"['Elena Mayorova', 'Sergey Gazarov', 'Valeriy Barinov', 'Anton Tabakov', 'Yuri Smirnov', 'rare_actor', 'Leonid Timtsunik', 'Lyudmila Artemeva', 'Yuri Katin-Yartsev', 'Irina Rozanova']","[3.044522437723423, 3.8712010109078907, 3.8712010109078907, 2.4849066497880004, 2.3978952727983707, 0.1, 2.4849066497880004, 2.995732273553991, 3.713572066704308, 4.204692619390966]",['rare_director'],['Ganna Oganisyan-Slutski'],True,True,True,[],['Soviet Union'],['Russian'],False,True,True,,0,5.4,28,0.724,79,True,,,False,False,https://image.tmdb.org/t/p/w500/9Yjw8gZXuB7KFu1TQfVN9Q7oGS2.jpg,,True,False
275442,304273,Kalabaaz,Kalabaaz,hi,1977-06-30,1977,True,False,"Daredevil Circus trapeze artistes, Vijay and Radha, who also goes by the name of Lisa, are in love with each other. The circus is run by Radha's dad, G.D. Sapru. One day they decide to do another daredevil act without any safety net support to break their fall. As a result, Radha misses Vijay and falls down to the ground, is seriously wounded, and hospitalized. After she recovers, she is told that her face has been completely disfigured. She decides not to show her face to Vijay and goes abroad forever. Then Vijay is approached by a group of Hindu priests who want him to locate two statues of Bhagwan Shri Kishan and Devi Maa Radha through the treacherous and mountainous region between India and Burma. Vijay agrees to do so and accompanied by Mangu, Changu, Sandoz, they set out on their journey.",,[],,[],True,False,True,"['Zeenat Aman', 'Dev Anand', 'Govardhan Asrani', 'Pradeep Kumar', 'A.K. Hangal', 'rare_actor', 'Dev Kumar', 'Sujit Kumar', 'Lalita Kumari']","[4.290459441148391, 4.532599493153256, 5.484796933490655, 4.174387269895637, 4.48863636973214, 0.1, 2.833213344056216, 4.330733340286331, 3.044522437723423]",['Ashok Roy'],"['S.M. Abbas', 'Tarun Ghosh', 'rare_writer']",True,True,True,[],['India'],['Hindi'],False,True,True,,0,6.4,38,0.84,145,True,,,False,False,https://image.tmdb.org/t/p/w500/eBhlYoTWQxWeLrZO2JAaGnBysbB.jpg,,True,False
41272,226427,Curtain Razor,Curtain Razor,en,1949-05-21,1949,True,False,"Porky, a talent scout for ""Goode and Korney Talent Agency,"" auditions various acts. A final gag has a wolf performing this ""stupendous act"" where he wears a devil hat, cape and the like, drinks nitroglycerin, gasoline and other explosive stuff, then swallows a match. KABOOM! Porky thinks that the act is really good until the wolf's ghost comes in and says that there's a catch... ""I can only do it once!""(Source: bcdb.com)",,"['animation', 'comedy']",short film,['short film'],True,False,True,"['Mel Blanc', 'Dave Barry', 'Stan Freberg', 'Dorothy Lloyd', 'Cliff Nazarro', 'rare_actor']","[6.9411900550683745, 3.4965075614664802, 4.31748811353631, 1.9459101490553132, 3.4011973816621555, 0.1]",['Friz Freleng'],['Tedd Pierce'],True,True,True,"['Warner Bros. Pictures', 'Warner Bros. Cartoons']",['United States of America'],['English'],True,True,True,6.4,11,6.9,389,1.6,7,True,,,False,False,https://image.tmdb.org/t/p/w500/vUUM5dfZQ1THwNW4whQCsNWUBV4.jpg,https://image.tmdb.org/t/p/w500/oOUFColJB61paFDXyaPO57CjGh6.jpg,True,True
1777591,88424,Sexual Witchcraft,Sexual Witchcraft,en,2011-10-18,2011,True,False,Witches have moved into the neighborhood and Michelle Bauer is not happy about it. Christine Nguyen and her husband have irked the neighbors with their sexual sorcery. Holly Sampson has come down from sexual witch heaven to help Christine navigate the modern world. She imports Cleopatra for reasons that are too ridiculous to mention. It all ends with a lot of mediocre sex and a great ad campaign for Christine's husband. But I'm with Bauer. Her neighbors are bringing down property value in the softcore neighborhood.,,"['comedy', 'fantasy']",,[],True,False,True,"['Michelle Bauer', 'Christine Nguyen', 'Holly Sampson', 'Michelle Maylene', 'Cassandra Cruz', 'rare_actor', 'Billy Chappell', 'Randy Spears', 'Eric Masterson', 'Ted Newsom']","[4.90527477843843, 4.02535169073515, 3.4657359027997265, 3.1354942159291497, 3.1780538303479458, 0.1, 3.713572066704308, 5.683579767338681, 4.77912349311153, 3.4657359027997265]",['Fred Olen Ray'],['Fred Olen Ray'],True,True,True,[],[],['English'],False,False,True,4.045,11,4.4,208,2.557,83,True,,,False,False,https://image.tmdb.org/t/p/w500/2N0u1woYtumWgD9OIcTQGDmvZm7.jpg,,True,False
2103246,315370,Santa in Animal Land,Santa in Animal Land,en,1948-01-01,1948,True,False,Animal puppets seek out Santa to find out why he doesn't deliver presents to them.,,"['family', 'tv movie', 'fantasy']","christmas, short film","['christmas', 'short film']",True,False,True,[],[],['Stefan Sharff'],[],False,True,False,"['other_company', 'other_company']",['United States of America'],['English'],True,True,True,,0,3.9,140,0.6,9,True,,,False,False,https://image.tmdb.org/t/p/w500/syVWdE8ywpnL0nZN0DN3xelNcSV.jpg,,True,False
13262002,826713,Thank You Brother!,థ్యాంక్‌ యు బ్రదర్‌,te,2021-05-07,2021,True,False,"A story of two contrasting individuals — a wealthy youngster who loves to live life partying and wooing women, without a care in the world for anything else, and a pregnant woman who loses her husband and is struggling in life. The two of them get stuck in a lift for several hours, turning both their lives upside down.",,['thriller'],,[],True,False,True,"['Anasuya Bharadwaj', 'Viraj Ashwin', 'rare_actor', 'Viva Harsha', 'Aadarsh Balakrishna', 'Anish Kuruvilla', 'Annapoorna', 'Kadambari Kiran', 'rare_actor', 'rare_actor']","[2.8903717578961645, 1.791759469228055, 0.1, 3.6635616461296463, 2.9444389791664403, 3.091042453358316, 4.356708826689592, 2.0794415416798357, 0.1, 0.1]",['rare_director'],['rare_writer'],True,True,True,[],[],['Telugu'],False,False,True,,0,5.7,280,1.166,94,True,,,False,False,https://image.tmdb.org/t/p/w500/fMpJ85Dg7aEk1jwqBMEa2sVKJNb.jpg,https://image.tmdb.org/t/p/w500/3zuxvylGoSLsD7DGU5d1bzHRD0J.jpg,True,True
133295,502263,Maya the Bee,みつばちマーヤの冒険,ja,1975-04-01,1975,True,False,"The adventures of a young and happy bee who is sent by her queen to search for pollen, and in doing so she finds a new world that surrounds her, making friends with various forest creatures.",,['animation'],,[],True,False,True,[],[],"['rare_director', 'rare_director', 'Hiroshi Saito']","['Waldemar Bonsels', 'rare_writer', 'Niisan Takahashi', 'rare_writer', 'rare_writer', 'rare_writer']",False,True,True,[],['Japan'],['Japanese'],False,True,True,6.7,3,6.7,4934,0.68,,False,,,False,False,https://image.tmdb.org/t/p/w500/36DwbpFjXjqHKTl9XSvgl8ZmPLx.jpg,https://image.tmdb.org/t/p/w500/7j5Gq6FaEI3WTzXiemt6uYmRsUo.jpg,True,True
134714,316044,Die heilige Hure,Die heilige Hure,de,1997-11-19,1997,True,False,,,['drama'],,[],False,False,True,"['Susanna Simon', 'rare_actor', 'Sven Martinek', 'Holger Handtke', 'Bernadette Heerwagen', 'Oliver Mommsen']","[3.8501476017100584, 0.1, 3.258096538021482, 2.772588722239781, 3.8918202981106265, 3.9512437185814275]",['Dominique Othenin-Girard'],"['rare_writer', 'Wolfgang Kirchner', 'Petra Welzel', 'Christos Yiannopoulos']",True,True,True,[],['Germany'],[],False,True,False,3.0,2,4.7,42,0.704,,False,,,False,False,,,False,False
78275,402476,Ski Lift to Death,Ski Lift to Death,en,1978-03-03,1978,True,False,"A sports promoter tries to matchmake for a pair of ski champions and, as a result, they end up trapped in a derailed ski-lift car along with a gangster and the hitman sent to kill him.",Suspended in Terror,"['thriller', 'tv movie', 'drama']","dancing, hitman, competition, gangster, ski jump, snow skiing, professional sports, ski lift, disaster movie, disco music","['dancing', 'hitman', 'competition', 'gangster', 'ski jump', 'snow skiing', 'professional sports', 'ski lift', 'disaster movie', 'disco music']",True,True,True,"['Deborah Raffin', 'Charles Frank', 'Don Galloway', 'Gail Strickland', 'Don Johnson', 'Veronica Hamel', 'Howard Duff', 'Clu Gulager', 'rare_actor', 'Pierre Jalbert']","[3.4965075614664802, 2.9444389791664403, 2.995732273553991, 3.6109179126442243, 4.07753744390572, 3.367295829986474, 3.9889840465642745, 4.189654742026425, 0.1, 1.791759469228055]",['William Wiard'],['Laurence Heath'],True,True,True,"['other_company', 'Paramount Television Studios']",['United States of America'],['English'],True,True,True,,0,4.7,96,1.328,100,True,,,False,False,https://image.tmdb.org/t/p/w500/awGigjShsyhXBkpCbPPjSxRnHfO.jpg,https://image.tmdb.org/t/p/w500/5O1WDfsauUuzLaDGa00NJ7Ddz2b.jpg,True,True
