imdbId,tmdbId,title,original_title,original_language,release_date,release_year,has_release_date,adult,overview,tagline,genres,keywords,keywords_list,has_overview,has_tagline,has_keywords,cast_list,cast_weight,directors,writers,has_cast,has_directors,has_writers,production_companies,production_countries,spoken_languages,has_production_company,has_production_country,has_spoken_language,average_rating_tmdb,num_votes_tmdb,average_rating_imdb,num_votes_imdb,popularity,runtime,has_runtime,budget,revenue,has_budget,has_revenue,poster_url,backdrop_url,has_poster,has_backdrop
1268957,416890,Adventures in Odyssey: The Last Days of Eugene Meltsner,Adventures in Odyssey: The Last Days of Eugene Meltsner,en,2000-09-12,2000,True,False,"Through Whit’s new invention, the Micro-stimulator, Eugene takes a fantastic voyage through his own circulatory system and makes an alarming discovery. Forced to reevaluate how he’ll spend the remaining days of his life, he sets in motion a chain of events that includes a bank heist, a ticking bomb, and a strangely familiar window washer!",,"['animation', 'adventure', 'family']",,[],True,False,True,"['Will Ryan', 'rare_actor', 'rare_actor', 'Katie Leigh', 'rare_actor']","[3.7376696182833684, 0.1, 0.1, 2.995732273553991, 0.1]",['Robert Vernon'],"['Robert Vernon', 'Phil Lollar', 'Steve Harris']",True,True,True,[],[],[],False,False,False,6.0,1,7.7,48,0.814,30,True,,,False,False,https://image.tmdb.org/t/p/w500/5uEVAtkuoOHwE5qlxFsjFCJV17Y.jpg,,True,False
482963,209746,Fist Fight,Fist Fight,en,1964-01-01,1964,True,False,"Breer's extraordinary autobiographical film combines personal and family photos with intense colors, textures and geometric abstractions. Originally presented as part of Karlheinz Sotckhausen's 1964 premiere of Originale. - Harvard Film Archive",,['documentary'],,[],True,False,True,[],[],['Robert Breer'],[],False,True,False,[],['United States of America'],['No Language'],False,True,True,4.7,6,5.7,78,0.658,11,True,,,False,False,https://image.tmdb.org/t/p/w500/pAxXtBxQQfViTbVaZTRW1SpWzUI.jpg,,True,False
459268,317045,The Edge of the World,The Edge of the World,en,2005-09-01,2005,True,False,"Three men are reunited after 30 years by the echoes of a terrible crime. Old men now, and at the end of the line they are intrigued to meet a young girl named Sarah. Through her they are plunged back into the sordid (and hilarious) belly of Australia's underworld, both past and present.",You always miss what you leave behind,"['thriller', 'drama']","dark past, criminal gang","['dark past', 'criminal gang']",True,True,True,"['rare_actor', 'rare_actor', 'John Andrews', 'rare_actor', 'Robin Queree', 'rare_actor', 'rare_actor', 'rare_actor', 'rare_actor', 'rare_actor']","[0.1, 0.1, 2.5649493574615367, 0.1, 1.791759469228055, 0.1, 0.1, 0.1, 0.1, 0.1]",['Shaun Jefford'],['rare_writer'],True,True,True,[],['Australia'],[],False,True,False,,0,6.8,82,0.895,90,True,,,False,False,https://image.tmdb.org/t/p/w500/oADpF8rd48g2MqjR1ueLkTiLiaS.jpg,,True,False
134824,263551,Strange Friends,陌生的朋友,zh,1982-01-01,1982,True,False,"Three strangers, two men and a woman, end up sharing a compartment on a train leaving Beijing for Shanghai -- the lone woman is quiet while one of the young men is gregarious and funny, and the other is more reserved, but compassionate. Eventually, the men cannot help but note the woman's silence -- it turns out she is running away from her employers who felt she was pretty much a derelict, and from some friends who were of questionable ethics, though she is not about to say anything to the two men. When she gets off the train in Nanjing, one of the young men from the train -- somewhat worried about his silent travel partner -- decides to follow her to make sure she will be okay. And it is a good thing he did so because she is menacingly approached by some obvious thugs and the young man gets her out of the potentially hazardous encounter.",,['drama'],,[],True,False,True,['rare_actor'],[0.1],['Lei Xu'],"['rare_writer', 'Lei Xu', 'rare_writer']",True,True,True,['Beijing Film Studio'],['China'],['Mandarin'],True,True,True,,0,6.8,11,0.6,80,True,,,False,False,https://image.tmdb.org/t/p/w500/ffivCFa801PZ89s0L8nP8k7prgR.jpg,https://image.tmdb.org/t/p/w500/kTvw974esuaqtsT0t0PrPao2hJU.jpg,True,True
1433172,316509,Relations.,Relations.,en,2007-03-27,2007,True,False,"Two friends try to find meaning in life with women. David dreams of the perfect move to reclaim the heart of his Ex. Adam lusts for his cousin. In the end, both will determine the method for action and salvation.","A story about life, laughter, and falling in love with one's cousin","['comedy', 'romance']",,[],True,True,True,"['rare_actor', 'rare_actor', 'rare_actor']","[0.1, 0.1, 0.1]",['rare_director'],"['rare_writer', 'rare_writer']",True,True,True,['other_company'],['United States of America'],['English'],True,True,True,8.0,1,6.7,15,0.6,72,True,2000,,True,False,,,False,False
108123,271222,Shotgun Wedding,Shotgun Wedding,en,1993-09-11,1993,True,False,Shotgun Wedding is a 1993 Australian film based on the Wally Melish siege.,,['crime'],,[],True,False,True,"['Aden Young', 'Zoe Carides', 'Marshall Napier', 'John Clayton', 'Paul Chubb', 'rare_actor', 'rare_actor', 'Andrew S. Gilbert', 'Sean Scully', 'rare_actor']","[3.4011973816621555, 2.9444389791664403, 3.4657359027997265, 3.295836866004329, 3.1780538303479458, 0.1, 0.1, 3.091042453358316, 2.772588722239781, 0.1]",['Paul Harmon'],"[""David O'Brien""]",True,True,True,[],[],['English'],False,False,True,,0,5.6,32,0.919,94,True,,,False,False,https://image.tmdb.org/t/p/w500/3ZonZGe94So4vKljQT2RP8kowjM.jpg,,True,False
166699,74219,A Face to Kill for,A Face to Kill for,en,1999-04-13,1999,True,False,"Accomplished horse trainer is deceived by her husband, unfairly sent to prison, and she re-makes herself and eventually gains revenge.",,"['tv movie', 'drama']",,[],True,False,True,"['Crystal Bernard', 'Doug Savant', 'rare_actor', 'Claire Rankin', 'rare_actor', 'Dennis Letts', 'Patti Yasutake', 'Barry Corbin', 'Libby Villari', 'rare_actor']","[3.044522437723423, 3.1354942159291497, 0.1, 2.70805020110221, 0.1, 2.639057329615259, 1.9459101490553132, 4.727387818712341, 1.791759469228055, 0.1]",['Michael Toshiyuki Uno'],"['Andrew Laskos', 'David Venable']",True,True,True,"['other_company', 'Wilshire Court Productions']",['United States of America'],['English'],True,True,True,6.0,2,5.7,311,2.578,87,True,,,False,False,https://image.tmdb.org/t/p/w500/wZB7Wz9OOjy5Aau6YERJ7DpQ26v.jpg,https://image.tmdb.org/t/p/w500/oZUrMHZom1EWK0zoKrSFy03qx4v.jpg,True,True
2945024,572265,Red Lights,Red Lights,en,2013-04-02,2013,True,False,"A young Dutch boy goes on a boy's night out with his friends in Amsterdam for a night of sex,drugs and rock and roll. But an expected encounter with a sex worker shows him something he could have never imagined.",,"['mystery', 'drama']",short film,['short film'],True,False,True,"['rare_actor', 'rare_actor', 'rare_actor']","[0.1, 0.1, 0.1]",['Doris Yeung'],['Doris Yeung'],True,True,True,[],[],[],False,False,False,6.0,1,5.1,12,0.6,13,True,,,False,False,https://image.tmdb.org/t/p/w500/viKa7nnwBXnSYRWMyw3Cldhd9Yh.jpg,https://image.tmdb.org/t/p/w500/ya6LLRS3C1gkDxBT3Akf0b5aw8.jpg,True,True
478385,1076767,Mualla,Mualla,tr,1971-10-01,1971,True,False,,,[],,[],False,False,True,"['Fatma Girik', 'Kadir Inanr', 'Diclehan Baban', 'Seyhan Gumus', 'Nukhet Egeli', 'Aydn Tezel', 'Muammer Gozalan']","[4.882801922586371, 4.875197323201151, 3.5553480614894135, 1.9459101490553132, 2.302585092994046, 3.1354942159291497, 4.442651256490317]",['Nevzat Pesen'],"['Muazzez Tahsin Berkant', 'Nevzat Pesen']",True,True,True,[],[],[],False,False,False,,0,3.4,18,0.6,,False,,,False,False,https://image.tmdb.org/t/p/w500/i7o3VTSzjVH3XkpD3encKcnWDH8.jpg,,True,False
4883010,394334,Across the Sea,De L'Autre Côté de la Mer,fr,2015-08-27,2015,True,False,"A former war photographer tries to ward off his personal ghosts by taking pictures of trees only. He lives alone among olive trees in southern Italy. One day he decides to cross the sea. Once in Albania, he goes near the location where he had made his last war picture, as if he was retracing his steps. He finds a tree he wants to photograph. He is just about to do so, when he discovers a runaway girl hiding in it with the sole objective of crossing the sea and getting to the other side. The man has no choice. He has to flee with her, follow her and guide her along until a storm separates them.",,['drama'],"war crimes, runaway, migration, photograph, fleeing","['war crimes', 'runaway', 'migration', 'photograph', 'fleeing']",True,False,True,"['Carlo Brandt', 'rare_actor', 'Michele Venitucci']","[3.7376696182833684, 0.1, 2.9444389791664403]",['rare_director'],['rare_writer'],True,True,True,"['other_company', 'RTS', 'other_company']",['Switzerland'],"['Albanian', 'English', 'French', 'Italian']",True,True,True,,0,6.8,19,0.901,110,True,,,False,False,https://image.tmdb.org/t/p/w500/p3RtZl3rwZAlWpOyWOgqomhjLPk.jpg,https://image.tmdb.org/t/p/w500/EZCKyaSOE9fe1hLrTeBp0jeymF.jpg,True,True
343936,442179,Der kleine Prinz,Der kleine Prinz,de,1990-01-31,1990,True,False,,,['animation'],"novel, prinz","['novel', 'prinz']",False,False,True,"['Sabine Bohlmann', 'rare_actor', 'rare_actor', 'rare_actor', 'Wolfgang Hess', 'Thomas Reiner', 'Rolf Illig', 'Franz Rudnick', 'rare_actor', 'Gernot Duda']","[1.9459101490553132, 0.1, 0.1, 0.1, 1.9459101490553132, 2.4849066497880004, 2.8903717578961645, 3.5263605246161616, 0.1, 3.4011973816621555]",['rare_director'],"['rare_writer', 'Antoine De Saint-Exupery']",True,True,True,"['other_company', 'ZDF', 'ORF']",['Germany'],['German'],True,True,True,8.3,3,8.1,88,1.567,65,True,,,False,False,https://image.tmdb.org/t/p/w500/yOmDVZ8f3m5HFsCfq2IcWLoA76D.jpg,https://image.tmdb.org/t/p/w500/hTY7IiGwvdhtwHNnvvIuenGVqb0.jpg,True,True
867150,1175082,Dark Night,Dark Night,en,,,False,False,"A group of teenagers get more than they bargained for at a secret party held in a long abandoned house, pitting their wits against monsters, the undead and each other. A British B-movie with big bite, definitely not for the faint of heart or the weak of stomach! Will you survive the Dark Night?",Will you survive it?,[],,[],True,True,True,"['rare_actor', 'rare_actor', 'rare_actor']","[0.1, 0.1, 0.1]",['rare_director'],['rare_writer'],True,True,True,[],[],[],False,False,False,,0,6.2,60,0.6,90,True,,,False,False,,,False,False
80703,271845,The Exile,L'éxilé,fr,1980-01-02,1980,True,False,"Based on a traditional African tale. A king has the habit whilst walking in disguise on the streets of his kingdom to listen to the wishes of his own people. One day he overhears two brothers daydreaming out loud about marrying the king's daughters, even if that meant being beheaded one year later. The weddings take place and one of the brother is decapitated one year later. The other one escapes execution at his wife's insistence. On a long journey full of surprising incidents, our hero himself becomes king of a village with wives and subjects. However, his earlier promise haunts him, and in order to save his family he accepts to be sacrificed.",,['drama'],africa,['africa'],True,False,True,"['Zalika Souley', 'Damoure Zika']","[1.9459101490553132, 2.4849066497880004]",['Oumarou Ganda'],['Oumarou Ganda'],True,True,True,['other_company'],"['France', 'other_country']",['French'],True,True,True,6.25,4,6.9,29,0.6,90,True,,,False,False,,,False,False
13315048,806235,Dusk,Félhomály,en,2020-11-21,2020,True,False,"A landguard and his son go on patrol in a border area, where an invisible danger looms.",,['documentary'],,[],True,False,True,[],[],['rare_director'],"['rare_writer', 'Ezequiel Salinas']",False,True,True,[],['Hungary'],['Hungarian'],False,True,True,,0,7.2,10,0.6,21,True,,,False,False,https://image.tmdb.org/t/p/w500/iQyzBYgOVpo0qnuqOXXaIckcoXZ.jpg,,True,False
110634,461370,Natural Causes,Natural Causes,en,1994-04-01,1994,True,False,An American links her mothers death in Bankok to a plot involving Vietnamese refugees.,,['action'],"espionage, thailand, murder","['espionage', 'thailand', 'murder']",True,False,True,"['Linda Purl', 'Cary-Hiroyuki Tagawa', 'Ali Macgraw', 'Will Patton', 'Janis Paige', 'Tim Thomerson']","[3.970291913552122, 4.07753744390572, 3.044522437723423, 4.394449154672439, 3.5553480614894135, 4.59511985013459]",['James Becket'],['rare_writer'],True,True,True,['other_company'],['United States of America'],['English'],True,True,True,5.0,1,5.0,199,0.83,,False,,,False,False,https://image.tmdb.org/t/p/w500/qcePkETCfXzciTkWRVPIpyenPlq.jpg,,True,False
1826593,82760,Avalon,Avalon,sv,2011-09-11,2011,True,False,"Janne, a 60 year old party promoter is arranging a nightclub at the annual tennis week in the small coastal town of Båstad, where he also teams up with his older sister Jackie. But an accident turns his life upside down and forced by the people around him, he desperately seeks a way out.",,"['drama', 'thriller']",,[],True,False,True,"['Johannes Brost', 'Peter Carlberg', 'rare_actor', 'Carl Johan De Geer', 'rare_actor', 'rare_actor', 'rare_actor', 'rare_actor', 'rare_actor', 'rare_actor']","[3.1780538303479458, 2.302585092994046, 0.1, 2.833213344056216, 0.1, 0.1, 0.1, 0.1, 0.1, 0.1]",['Axel Petersen'],['Axel Petersen'],True,True,True,"['other_company', 'other_company', 'other_company']",['Sweden'],"['Swedish', 'English']",True,True,True,5.5,12,5.4,1306,1.912,79,True,,,False,False,https://image.tmdb.org/t/p/w500/fMrjlkYhEOzeZrMBTrBCGBe2367.jpg,https://image.tmdb.org/t/p/w500/yXDBvYIbYUG9sEqLXDJalVphRzR.jpg,True,True
322545,4326,Berlin Blues,Herr Lehmann,de,2003-10-01,2003,True,False,"In October 1989, the part of the West Berlin borough of Kreuzberg called SO 36, had been largely shut off by the Wall from the rest of the city for 28 years. A lethargic sub-culture of students, artists, bohemians and barflys had flourished among crumbling buildings. Part of that microcosm is barkeeper Frank, semi-formally called 'Herr Lehmann' by friends and patrons. He hangs out drinking, sports utter disregard for anything beyond SO 36 and lazily pursues an affair with cook Katrin. His lifestyle is gradually disturbed, when his parents show up for a visit, things go awry with Katrin and his best friend Karl starts to act strange. Meanwhile, political turmoil mounts on the other side of the Wall.","Bis denn, dann...","['comedy', 'drama']",kreuzberg,['kreuzberg'],True,True,True,"['Christian Ulmen', 'Katja Danowski', 'Detlev Buck', 'Janek Rieke', 'Uwe Dag Berlin', 'rare_actor', 'rare_actor', 'Margit Bendokat', 'Johann Adam Oest', 'Annika Kuhl']","[3.2188758248682006, 2.639057329615259, 3.970291913552122, 3.5263605246161616, 2.3978952727983707, 0.1, 0.1, 2.70805020110221, 3.1780538303479458, 3.1780538303479458]",['Leander Haumann'],['Sven Regener'],True,True,True,"['other_company', 'ARD']",['Germany'],['German'],True,True,True,6.848,99,7.1,7841,5.182,105,True,,,False,False,https://image.tmdb.org/t/p/w500/1jxhEu4H4dOMA5cLxRbGd7K5KUU.jpg,https://image.tmdb.org/t/p/w500/vwzgrZvKxj5HLLR3kADvIZlBGdK.jpg,True,True
27385597,1116575,The Purple Season,La saison pourpre,fr,2023-05-17,2023,True,False,"On the edge of a mangrove, a group of girls live to the rhythm of the climate and the wild geese around them. They watch each other live and grow up at different ages. As time passes, tensions arise and rivalries develop.",,['animation'],short film,['short film'],True,False,True,[],[],['rare_director'],['rare_writer'],False,True,True,['other_company'],['France'],['French'],True,True,True,,0,5.7,32,0.6,10,True,,,False,False,https://image.tmdb.org/t/p/w500/8bOxqLXTlvemaeHsjWQEMsEAP3w.jpg,,True,False
4523928,364094,Fun Size Horror: Volume Two,Fun Size Horror: Volume Two,en,2015-10-15,2015,True,False,"A collection of gut-twisting and nerve-shredding tales, all Frankstein’d together to form a feature-length monster of the best and bloodiest in short-film horror.",Terrifying tales slashed down to fun size,['horror'],anthology,['anthology'],True,True,True,"['Karen Gillan', 'Matthew Cardarople', 'James Ransone', 'Tracie Thoms', 'Paul Telfer', 'Megan Duffy', 'Diva Zappa', 'Justin Gordon', 'rare_actor', 'rare_actor']","[3.828641396489095, 2.833213344056216, 3.713572066704308, 3.6375861597263857, 2.0794415416798357, 1.9459101490553132, 2.4849066497880004, 2.0794415416798357, 0.1, 0.1]","['Stephen Boyer', 'Ned Ehrbar', 'Karen Gillan', 'Max Isaacson', 'Vivian Lin', 'Michael May', 'Mark Alan Miller', 'Grant Olin', 'rare_director', 'Zeke Pinheiro', 'Patrick Rea', 'Andrew Wesman', 'rare_director']","['rare_writer', 'Ned Ehrbar', 'Mali Elfman', 'Karen Gillan', 'Max Isaacson', 'rare_writer', 'Vivian Lin', 'rare_writer', 'Grant Olin', 'rare_writer', 'rare_writer', 'Patrick Rea', 'rare_writer', 'rare_writer']",True,True,True,"['other_company', 'other_company', 'other_company']",['United States of America'],['English'],True,True,True,4.222,9,4.8,212,2.963,74,True,,,False,False,https://image.tmdb.org/t/p/w500/cDMBcNqPIaTkaWOetkMdc6rThkb.jpg,,True,False
3765728,329328,The Family Farm,The Family Farm,en,2014-01-01,2014,True,False,"The Family Farm explores the farm to table process through the lens of Canadian small farmers and identifies the systematic barriers they face in running a profitable farm. In its journey across the country, the film blends extraordinary shots of the Canadian farm landscape with discussions of the challenges and setbacks small farmers endure, as well as the turning points and breakthroughs that have allowed them to achieve success. As these intimate accounts are shared, traditional images of family farmers are redefined as we grow to see these individuals not only as farmers, but as teachers, botanists, and mechanics who open our eyes to the issues that continue to threaten small farmers as well as the importance of buying local and organic foods.",,['documentary'],,[],True,False,True,[],[],['rare_director'],"['rare_writer', 'rare_writer', 'rare_writer', 'rare_writer']",False,True,True,[],[],[],False,False,False,6.3,3,7.1,10,0.6,,False,,,False,False,https://image.tmdb.org/t/p/w500/b6pWl2JfS2v7yBteAyCYEC9Xsx.jpg,,True,False
173278,297545,Survivors,Survivors,en,1990-10-14,1990,True,False,"A group of teenage boys are tricked into accompanying their teacher on a survival holiday to a deserted island. But when the teacher suffers a nervous breakdown and turns hostile, the boys are forced to fend for themselves.",,['drama'],,[],True,False,True,"['Ian Hogg', 'rare_actor', 'rare_actor', 'rare_actor', 'rare_actor', 'rare_actor', 'rare_actor', 'rare_actor', 'rare_actor', 'rare_actor']","[3.1780538303479458, 0.1, 0.1, 0.1, 0.1, 0.1, 0.1, 0.1, 0.1, 0.1]",['Colin Finbow'],['Peter King'],True,True,True,['other_company'],['United Kingdom'],['English'],True,True,True,,0,5.8,16,0.6,74,True,,,False,False,https://image.tmdb.org/t/p/w500/aGA0w83YuoH1twHRBGnnTaeW17n.jpg,,True,False
5192464,769050,Lords of Riga,Rīgas kungi,lv,2015-11-03,2015,True,False,"Lords of Riga allows to see an insight into a passionate subculture of bike couriers. Weaving their way through the urban traffic, they have become silent and sometimes unnoticed witnesses of everyday life in Riga as well as examples of our modern-day society. What is freedom to this bunch of rebellious messengers and where it ends?",,['documentary'],bicycle courier,['bicycle courier'],True,False,True,[],[],['rare_director'],['rare_writer'],False,True,True,"['other_company', 'other_company']",['Latvia'],[],True,True,False,,0,6.7,16,0.6,26,True,,,False,False,https://image.tmdb.org/t/p/w500/4LB7Cjo23zajsSfi4dWv3r3oPIY.jpg,,True,False
1594562,58428,The Innkeepers,The Innkeepers,en,2011-08-18,2011,True,False,"During the final days at the Yankee Pedlar Inn, two employees determined to reveal the hotel's haunted past begin to experience disturbing events as old guests check in for a stay.",Some guests never checked out.,"['horror', 'thriller']","hotel, anti terror, supernatural, beer, connecticut, towel, inn, phone, whispering","['hotel', 'anti terror', 'supernatural', 'beer', 'connecticut', 'towel', 'inn', 'phone', 'whispering']",True,True,True,"['Sara Paxton', 'Pat Healy', 'Kelly Mcgillis', 'rare_actor', 'John Speredakos', 'Brenda Cooney', 'Alison Bartlett', 'Jake Ryan', 'rare_actor', 'rare_actor']","[3.5553480614894135, 3.6888794541139363, 3.784189633918261, 0.1, 2.9444389791664403, 1.791759469228055, 2.772588722239781, 2.639057329615259, 0.1, 0.1]",['Ti West'],['Ti West'],True,True,True,"['other_company', 'other_company']",['United States of America'],['English'],True,True,True,5.402,591,5.5,39083,11.35,101,True,750000,78396,True,True,https://image.tmdb.org/t/p/w500/pQMNTV9kzmqymqqDGBfEQSK9yCt.jpg,https://image.tmdb.org/t/p/w500/lPBXvtVZszCnuArfbnFMe735gwO.jpg,True,True
58373,244532,Moro Witch Doctor,Moro Witch Doctor,en,1964-11-01,1964,True,False,The murders of two American plantation owners leads an Interpol agent into a battle with Filipino drug smugglers and violent religious fanatics.,Contraband Crime Ring Turns Illicit Tribal Rites Into Deadly Profit!,"['action', 'adventure']","crime ring, witch doctor, psychotronic film","['crime ring', 'witch doctor', 'psychotronic film']",True,True,True,"['Jock Mahoney', 'Margia Dean', 'Reed Hadley', 'Pancho Magalona', 'Paraluman', 'Michael Parsons', 'Dale Ishimoto', 'Vic Diaz']","[4.007333185232471, 3.5263605246161616, 4.02535169073515, 2.1972245773362196, 2.302585092994046, 1.791759469228055, 2.1972245773362196, 4.127134385045092]",['Eddie Romero'],['Eddie Romero'],True,True,True,"['other_company', 'other_company']","['Philippines', 'United States of America']",['English'],True,True,True,,0,4.7,21,0.762,61,True,,,False,False,https://image.tmdb.org/t/p/w500/iJtknDlnaZFcAsvQEFpcUxRRpG7.jpg,https://image.tmdb.org/t/p/w500/ymTcks5rULFmKorD1xDmyEuh33d.jpg,True,True
93258,68883,Rouge,胭脂扣,zh,1987-12-05,1987,True,False,"The ghost of a courtesan who died in 1934 returns to Hong Kong fifty-three years later, seeking to reunite with the man she loved.",They loved across two generations and two different worlds.,"['drama', 'fantasy', 'romance', 'mystery']",brothel,['brothel'],True,True,True,"['Anita Mui Yim-Fong', 'Leslie Cheung', 'Alex Man Chi-Leung', 'Emily Chu Bo-Yee', 'Irene Wan', 'Tam Sin-Hung', 'rare_actor', 'Wong Yu', 'Lau Kar-Wing', 'Kara Hui Ying-Hung']","[3.8066624897703196, 3.7376696182833684, 4.3694478524670215, 3.1354942159291497, 3.4965075614664802, 2.772588722239781, 0.1, 3.9512437185814275, 3.7612001156935624, 4.2626798770413155]",['Stanley Kwan'],"['Pik-Wah Lee', 'Kang-Chien Chiu']",True,True,True,"['other_company', 'Orange Sky Golden Harvest']",['Hong Kong'],['Cantonese'],True,True,True,7.4,53,7.3,3958,10.684,96,True,,,False,False,https://image.tmdb.org/t/p/w500/q2wAAeGagOmqmqEkEgveLJYBj89.jpg,https://image.tmdb.org/t/p/w500/qSVBdYVbS2Abui6oGJdzSizhk94.jpg,True,True
196642,468150,"Ησαΐα, μη Χορεύεις","Ησαΐα, μη Χορεύεις",el,1969-07-27,1969,True,False,"Lambros has a bizarre office that does crazy jobs, because he is not a fan of the ""Fake pie to eat"" theory, but he also puts his hand on every time he wants to reach a happy ending in a neighborhood. But he believes that marriage is a bad thing, until the day when the female Satan, using tricks similar to his own, appears in front of him.",,['comedy'],"office, greece, marriage, employee, matchmaking, 1960s, matchmaker","['office', 'greece', 'marriage', 'employee', 'matchmaking', '1960s', 'matchmaker']",True,False,True,"['Labros Konstadaras', 'Jenny Roussea', 'Anna Matzourani', 'Nikitas Platis', 'Mitsi Konstadara', 'Andreas Barkoulis', 'Nasos Kedrakas', 'Danos Lygizos', 'Giorgos Grigoriou', 'Rena Pashalidou']","[4.343805421853684, 2.995732273553991, 3.5263605246161616, 4.23410650459726, 3.4011973816621555, 4.477336814478207, 3.970291913552122, 2.639057329615259, 2.8903717578961645, 2.0794415416798357]",['Kostas Karagiannis'],['Lakis Mihailidis'],True,True,True,['Karagiannis-Karatzopoulos'],['Greece'],['Greek'],True,True,True,5.0,2,5.2,234,1.4,89,True,,,False,False,https://image.tmdb.org/t/p/w500/7PMyNM7rHrU4Yyqp24Mgy5jWr1O.jpg,https://image.tmdb.org/t/p/w500/bqdFLXSRrEhjb5unvQD1cqbtsic.jpg,True,True
167220,69306,John the Baptist,John the Baptist,en,1990-06-17,1990,True,False,"John the Baptist is a story of courage and conviction seen through the life of one of God’s greatest prophets who gave everything to prepare the way for the Lord. It begins with the blessing John’s birth was to his aged parents. John grows in strength and integrity as he stands against political and spiritual adversity to preach the coming of the Lord. Finally, John beholds and baptizes Jesus, the Lamb of God.",,"['family', 'animation']",,[],True,False,True,"['Gregory Snegoff', 'rare_actor', 'Beverly Rowland', 'rare_actor', 'rare_actor', 'Pat Jackson', 'rare_actor', 'rare_actor', 'rare_actor', 'Dion Luther']","[2.5649493574615367, 0.1, 2.1972245773362196, 0.1, 0.1, 2.302585092994046, 0.1, 0.1, 0.1, 1.791759469228055]",['Richard Rich'],['Brian Nissen'],True,True,True,"['NEST Family Entertainment', 'other_company', 'other_company']",['United States of America'],['English'],True,True,True,,0,7.7,54,1.012,30,True,,,False,False,https://image.tmdb.org/t/p/w500/wnfBKtmjoREkZDykw1FSPTRd9vM.jpg,https://image.tmdb.org/t/p/w500/rr5YxCwopv5rg5N3mXB2xx2tHpF.jpg,True,True
218867,301731,Camino de Sacramento,Camino de Sacramento,en,1945-04-11,1945,True,False,"Twin brothers, one of them a bandit, in Mexican California.",,[],,[],True,False,True,"['Jorge Negrete', 'Rosario Granados', 'Julio Villarreal']","[3.784189633918261, 3.6635616461296463, 4.248495242049359]",['Chano Urueta'],"['Leopoldo Baeza Y Aceves', 'Ernesto Cortazar', 'Tito Davison', 'Alexandre Dumas', 'Honore De Balzac']",True,True,True,[],[],[],False,False,False,5.5,4,6.4,33,0.711,95,True,,,False,False,https://image.tmdb.org/t/p/w500/ohqlxRoe7Q571iJTDKqivanaaGX.jpg,,True,False
