imdbId,tmdbId,title,original_title,original_language,release_date,release_year,has_release_date,adult,overview,tagline,genres,keywords,keywords_list,has_overview,has_tagline,has_keywords,cast_list,cast_weight,directors,writers,has_cast,has_directors,has_writers,production_companies,production_countries,spoken_languages,has_production_company,has_production_country,has_spoken_language,average_rating_tmdb,num_votes_tmdb,average_rating_imdb,num_votes_imdb,popularity,runtime,has_runtime,budget,revenue,has_budget,has_revenue,poster_url,backdrop_url,has_poster,has_backdrop
195268,246745,Skipper,Skipper,it,1987-06-10,1987,True,False,,,"['adventure', 'thriller', 'tv movie']",,[],False,False,True,"['Fabio Testi', 'Mariangela Giordano', 'rare_actor', 'Corinne Clery', 'Helmut Berger', ""Barbara D'Urso"", 'rare_actor', 'Larry Dolgin', 'rare_actor', 'William Berger']","[4.0943445622221, 3.713572066704308, 0.1, 3.8501476017100584, 4.532599493153256, 2.0794415416798357, 0.1, 2.0794415416798357, 0.1, 4.442651256490317]",['Roberto Malenotti'],"['Massimo De Rita', 'Ugo Liberatore', 'Giorgio Stegani']",True,True,True,['RAI'],['Italy'],['Italian'],True,True,True,6.5,1,5.4,13,1.765,,False,,,False,False,,,False,False
442424,37478,"Profils paysans, chapitre 2 : Le Quotidien","Profils paysans, chapitre 2 : Le Quotidien",fr,2005-02-23,2005,True,False,"Second documentary of a trilogy produced on the long term (together with Profils paysans: l'approche (2001) and Profils paysans: La vie moderne (2008)), showing the simple lives of farmers in contemporary Southern France.",,['documentary'],,[],True,False,True,"['rare_actor', 'rare_actor', 'rare_actor', 'rare_actor', 'rare_actor', 'rare_actor', 'rare_actor', 'rare_actor', 'rare_actor', 'rare_actor']","[0.1, 0.1, 0.1, 0.1, 0.1, 0.1, 0.1, 0.1, 0.1, 0.1]",['Raymond Depardon'],['Raymond Depardon'],True,True,True,['other_company'],['France'],['French'],True,True,True,7.556,9,7.5,148,0.611,83,True,,,False,False,https://image.tmdb.org/t/p/w500/29HILMCxizXx68JgIraYMLWtWTj.jpg,,True,False
257081,308748,Saint Amour,Saint Amour,nl,2001-03-12,2001,True,False,"The year is 1969. Father Louis (27) lives in a monastery and his priesthood is a vocation for him. However when his friend and colleague priest Daniël starts having a relationship with a woman, Louis also starts to question his celibate life. Why is he not allowed to have intimate relations with another human being? A series of events make Louis rebel against the Catholic Church and in 1973 he leaves the monastery. Chance brings him into contact with Daikha, a woman who teaches him about love. In 1999 his short affair with Daikha is almost forgotten. Louis has turned away from the church and now lives with his childhood love Liliane. Then he gets news that will change Louis' life drastically for the third time.",,['drama'],,[],True,False,True,"['Antonie Kamerling', 'rare_actor', 'rare_actor', 'Jasperina De Jong', 'rare_actor', 'rare_actor', 'Renee Fokker', 'Matthijs Van De Sande Bakhuyzen', 'Marie Vinck']","[3.044522437723423, 0.1, 0.1, 1.791759469228055, 0.1, 0.1, 3.091042453358316, 3.091042453358316, 2.4849066497880004]",['Eric Oosthoek'],"['rare_writer', 'rare_writer']",True,True,True,[],[],['Dutch'],False,False,True,6.0,2,5.9,35,1.4,95,True,,,False,False,,,False,False
440361,45448,Three of a Kind,煎釀叁寶,zh,2004-07-26,2004,True,False,"Famous novelist Ngan (Michael Hui) is leading a comfortable life living on the royalties of his published novels. He has now placed all his attention onto his daughter Sophia (Miriam Yeung). Sophia has reached a suitable age for marriage and is still searching for her Prince Charming. She has a crush on Frankie (Lau Ching Wan), her boss and a playboy. Due to some accident, Frankie decides to stay at Sophia's home for a while, Then, Sophia and Frankie became lovers and are planning to get married! Ngan Loves his daughter so much that he knows he must destroy their love before it is too late. Sophia must make a life and death decision between Frankie and her father...",,"['romance', 'comedy']",,[],True,False,True,"['Michael Hui', 'Miriam Yeung Chin-Wah', 'Sean Lau Ching-Wan', 'Elaine Jin', 'Hui Shiu-Hung', 'Lo Meng', 'Hiro Hayama', 'Monica Lo', 'Jin Song', 'Kristal Tin']","[3.5263605246161616, 3.58351893845611, 4.663439094112067, 3.4339872044851463, 4.31748811353631, 4.02535169073515, 2.8903717578961645, 2.4849066497880004, 2.3978952727983707, 2.995732273553991]",['Joe Ma'],"['Matt Chow', 'Sunny Chan', 'Man Hong Lung', 'Joe Ma', 'Melvin Li']",True,True,True,"['other_company', 'other_company', 'China Film Co-Production Corporation', 'other_company', 'China Film Group Corporation']",['Hong Kong'],"['Mandarin', 'Cantonese']",True,True,True,6.333,3,4.8,160,1.445,102,True,,,False,False,https://image.tmdb.org/t/p/w500/ek9INrwXhQlaECBBt9pneZYZm29.jpg,https://image.tmdb.org/t/p/w500/suwvPpncrR4lkWW3pkJzmAFtXC7.jpg,True,True
1153102,14143,The Devil's Ground,The Devil's Ground,en,2008-05-19,2008,True,False,"While traveling from California to Bangor through a lonely road, Carrie Mitchel is advised by the gas station attendant Jimmy to rest in a hotel; however, she decides to continue driving through the night and almost hits a wounded teenage girl with blood on her face. She gives a lift to the girl and listens to the tale of her passenger and her friends.",,"['horror', 'thriller']",,[],True,False,True,"['Daryl Hannah', 'Leah Gibson', 'Luke Camilleri', 'Lee Tomaschefski', 'rare_actor', 'Jeb Beach', 'rare_actor', 'rare_actor']","[4.59511985013459, 2.639057329615259, 2.1972245773362196, 1.9459101490553132, 0.1, 1.9459101490553132, 0.1, 0.1]",['Micheal Bafaro'],['Micheal Bafaro'],True,True,True,[],['Canada'],['English'],False,True,True,4.967,30,4.4,1719,3.447,89,True,,,False,False,https://image.tmdb.org/t/p/w500/nBMqLCC3t2M3jAJo4hGZfJHHtUg.jpg,,True,False
3290338,62665,Cancer: The Forbidden Cures,Cancer: The Forbidden Cures,en,2010-06-20,2010,True,False,"Cancer is the only disease that has been defeated dozens of times without anyone knowing it. In the last 100 years, doctors, scientists, and researchers have developed diverse and effective solutions against cancer only to be thwarted by the political and propaganda power of the drug-dominated medical profession. This is the story of Essiac, Hoxsey, Laetrile, Shark Cartilage, Mistletoe, and Bicarbonate of Soda all put together in a stunning overview that leaves no doubt that inexpensive cures for cancer do exist but are systematically blocked by Big Pharma because they come from nature and cannot be patented. Highly informative.",Cancer is the only disease that has been defeated dozens of times without anyone knowing it. Why?,['documentary'],"medicine, cancer, alternative medicine, gerson therapy, terapia gerson","['medicine', 'cancer', 'alternative medicine', 'gerson therapy', 'terapia gerson']",True,True,True,"['Charlotte Gerson', 'G. Edward Griffin', 'rare_actor', 'rare_actor', 'rare_actor', 'rare_actor']","[2.0794415416798357, 2.639057329615259, 0.1, 0.1, 0.1, 0.1]",['Massimo Mazzucco'],['Massimo Mazzucco'],True,True,True,[],['Italy'],['English'],False,True,True,9.7,4,7.9,98,0.944,93,True,,,False,False,https://image.tmdb.org/t/p/w500/pu6myQKa2rt0TwK1UL87dudpHQf.jpg,,True,False
4439804,324812,Alien Tampon,Alien Tampon,de,2015-02-12,2015,True,False,"When an unsuspecting student inserts a blood drenched alientampon and mutates into a murdering monster, a group of students unite their forces in order to confront her with weapons and courage.",Some things are better left unused.,"['horror', 'comedy']",,[],True,True,True,"['Tom Beck', 'rare_actor', 'Bejo Dohmen', 'rare_actor', 'Daniel Wiemer', 'rare_actor', 'rare_actor', 'rare_actor']","[3.4011973816621555, 0.1, 1.791759469228055, 0.1, 1.9459101490553132, 0.1, 0.1, 0.1]",['rare_director'],"['rare_writer', 'rare_writer']",True,True,True,['other_company'],['Germany'],['German'],True,True,True,6.4,5,5.1,200,1.435,3,True,,,False,False,,https://image.tmdb.org/t/p/w500/gaZWWfrTJcSaQ3oxCyojglVP8vL.jpg,False,True
433441,190392,Reptilicant,Reptilicant,en,2006-06-13,2006,True,False,A team of treasure hunters take over Alcatraz Island in search of diamonds and encounter a shape-changing alien.,"Part Reptile, Part Replicant, Pure Rage","['science fiction', 'action', 'horror']","martial arts, shapeshifting, alcatraz prison","['martial arts', 'shapeshifting', 'alcatraz prison']",True,True,True,"['Gary Daniels', 'Tina Desiree Berg', 'rare_actor', 'rare_actor', 'Paul Darrigo', 'rare_actor']","[4.1588830833596715, 2.1972245773362196, 0.1, 0.1, 1.9459101490553132, 0.1]",['rare_director'],"['David Huey', 'rare_writer']",True,True,True,['other_company'],['United States of America'],['English'],True,True,True,7.0,3,2.2,226,0.956,92,True,2300000,,True,False,https://image.tmdb.org/t/p/w500/jV6fH43veldJNtBD4LktCJHYSjV.jpg,,True,False
6357504,467362,From Bangkok to Mandalay,ถึงคน.. ไม่คิดถึง,th,2016-10-27,2016,True,False,"Ten letters are sent from a man in Myanmar to a women in Thailand who loves and misses so much. But the letters are left unopened for 50 years. Until one day, the women's granddaughter is given those letters and asked to go and read every letter only from where they were written. This is how the impressive love story begins.",,['drama'],,[],True,False,True,"['rare_actor', 'Nay Toe', 'rare_actor', 'rare_actor', 'rare_actor']","[0.1, 1.9459101490553132, 0.1, 0.1, 0.1]",['Chartchai Ketnust'],['rare_writer'],True,True,True,['other_company'],"['Myanmar', 'Thailand']","['other_language', 'Thai']",True,True,True,6.5,3,6.6,205,0.686,120,True,,,False,False,https://image.tmdb.org/t/p/w500/f5Ulo70SZjXfWEeIOwYYG0J6MS2.jpg,,True,False
5663992,460370,Vapor,Vapor,es,2016-01-26,2016,True,False,"Former lovers randomly find each other, and start to catch up, walking in the Buenos Aires night.",,[],,[],True,False,True,['Julia Martinez Rubio'],[2.639057329615259],['rare_director'],['rare_writer'],True,True,True,[],['Argentina'],['Spanish'],False,True,True,5.5,4,6.1,29,0.6,70,True,,,False,False,https://image.tmdb.org/t/p/w500/u0QaCYO0ZZWTxQ68R2P6C7WTX2G.jpg,,True,False
1711484,65233,The Conquest,La Conquête,fr,2011-05-18,2011,True,False,A look at French president Nicolas Sarkozy's rise to power.,,"['comedy', 'drama']","political party, politics, prime minister, parliament","['political party', 'politics', 'prime minister', 'parliament']",True,False,True,"['Denis Podalydes', 'Florence Pernel', 'Bernard Le Coq', 'Michele Moretti', 'Samuel Labarthe', 'Emmanuel Noblet', 'Hippolyte Girardot', 'Mathias Mlekuz', 'Gregory Fitoussi', 'Pierre Cassignard']","[4.74493212836325, 3.970291913552122, 4.605170185988092, 3.970291913552122, 3.6109179126442243, 1.791759469228055, 4.51085950651685, 3.4339872044851463, 3.4657359027997265, 2.995732273553991]",['Xavier Durringer'],"['Patrick Rotman', 'Xavier Durringer']",True,True,True,"['other_company', 'Gaumont']",['France'],['French'],True,True,True,5.843,89,6.3,1738,4.888,105,True,,,False,False,https://image.tmdb.org/t/p/w500/iUFMMPjImAtKyVqP2uSqwKAraJk.jpg,https://image.tmdb.org/t/p/w500/mbx6sdBhdToY18hZVTTJDmK5bLt.jpg,True,True
1105384,1132508,Sheikh Saleh,شیخ صالح,fa,1973-09-12,1973,True,False,"1322 Islamic Calendar year; Iran before the constitutional revolution. People have formed a revolutionary committee to fight Khan. Cossack brigades are torturing and executing people, and Sheikh Saleh and his brother Esrafil with the help of an old man named Khajeh Isaa are prepared to fight against Khan and his steward Hollakoo.",,"['drama', 'history']",,[],True,False,True,"['Naser Malek Motiee', 'Sepideh', 'Jamshid Mehrdad', 'Mohsen Mahdavi', 'rare_actor', 'Reza Rakhshani', 'Kamran Bakhtar', 'rare_actor', 'rare_actor', 'rare_actor']","[4.110873864173311, 2.772588722239781, 3.1354942159291497, 2.3978952727983707, 0.1, 1.9459101490553132, 1.9459101490553132, 0.1, 0.1, 0.1]",['Aman Manteghi'],['Soheila Nasr'],True,True,True,['other_company'],['Iran'],['Persian'],True,True,True,,0,3.6,12,0.654,94,True,,,False,False,https://image.tmdb.org/t/p/w500/1xmnRifaF4MCxVk5luI8WoUOIVp.jpg,,True,False
145169,506841,Nooner,Nooner,en,1986-02-22,1986,True,True,A new employee at a contraceptive company finds his desktop computer magically relating how the other employees advanced in the company via sexual politics.,,[],,[],True,False,True,"['Nina Hartley', 'Keisha', 'Sheena Horne', 'Ebony Ayes', 'Tom Byron', 'Scott Irish', 'Randy West', 'Craig Roberts']","[5.697093486505405, 4.330733340286331, 3.5553480614894135, 3.1780538303479458, 6.359573868672378, 4.430816798843313, 5.723585101952381, 4.174387269895637]",['Chris Monte'],"['Marc Cushman', 'Chad Randolph']",True,True,True,[],[],[],False,False,False,6.0,1,6.1,110,0.6,85,True,,,False,False,https://image.tmdb.org/t/p/w500/3oOjp7UMQGOwlYB2vmUw2sp2hJx.jpg,,True,False
246166,938158,Prema Tarangalu,ప్రేమతరంగాలు,te,1980-10-24,1980,True,False,"Vijay, an orphan living alone in the city, saves a man named Kumar from thugs and becomes his best friend. However, he soon has to give up everything he holds dear for Kumar's happiness.",,"['action', 'drama', 'family']",,[],True,False,True,"['Krishnam Raju', 'Chiranjeevi', 'Jayasudha', 'Sujatha', 'Kaikala Satyanarayana', 'Kanta Rao', 'Savitri']","[2.995732273553991, 4.59511985013459, 4.51085950651685, 4.0943445622221, 4.941642422609304, 3.6888794541139363, 4.23410650459726]",['S.P. Chitti Babu'],"['rare_writer', 'Gollapudi Maruthi Rao', 'Laxmikant Sharma']",True,True,True,[],['India'],['Telugu'],False,True,True,,0,5.6,17,0.6,161,True,,,False,False,,,False,False
362204,316200,Supari,सुपारी,hi,2003-06-20,2003,True,False,"Four best friends end up owing 500,000 rupees to Mamta Sekhri, a woman involved in various underworld activities. The friends are forced to kill for money (an act called) ""Supari"" to pay their debt. But things begin to change when the men realize that in this game of Supari, they are not just hunters but also the hunted.",Your time starts now,"['action', 'crime', 'drama']",,[],True,True,True,"['Rahul Dev', 'Nandita Das', 'Purab Kohli', 'Nauheed Cyrusi', 'Irrfan Khan', 'Akashdeep Saigal']","[4.430816798843313, 3.6109179126442243, 3.1354942159291497, 2.772588722239781, 4.499809670330265, 1.791759469228055]",['Padam Kumar'],"['rare_writer', 'Atul Sabharwal', 'Mushtaq Shiekh', 'Sutapa Sikdar', 'Anuradha Tiwari']",True,True,True,[],[],['Hindi'],False,False,True,,0,4.3,180,0.739,143,True,578861,361618,True,True,https://image.tmdb.org/t/p/w500/cl8sT1si65Q10JDhOYva8FxfNhi.jpg,,True,False
110021,534058,Hey Stranger,Hey Stranger,en,1994-01-01,1994,True,False,"An actor and poet falls in love with a former mortuary photographer turned waitress. They find themselves caught up way over their heads in a dirty political and financial affair, an art smuggling case that touches them merely for the fact that it may separate them, be it through death or exile.",,[],,[],True,False,True,"['rare_actor', 'Benedicte Loyen', 'Hanna Schygulla', 'William Hickey', 'Guy Trejan', 'Jacques Seiler', 'rare_actor', 'rare_actor', 'Marcel Dossogne', 'Philippe Van Kessel']","[0.1, 1.9459101490553132, 4.532599493153256, 3.6109179126442243, 3.091042453358316, 2.772588722239781, 0.1, 0.1, 2.0794415416798357, 1.791759469228055]",['Peter Woditsch'],"['Sophie Schoukens', 'rare_writer', 'rare_writer']",True,True,True,[],[],[],False,False,False,,0,3.9,17,0.6,145,True,,,False,False,,,False,False
339090,306452,Die große Reise,Die große Reise,de,1961-05-17,1961,True,False,,,['drama'],,[],False,False,True,"['Agnes Fink', 'Paul Hubschmid', 'Werner Finck', 'Ingmar Zeisberg', 'Paul Esser']","[3.2188758248682006, 4.304065093204169, 3.9318256327243257, 3.367295829986474, 3.8066624897703196]",['William Dieterle'],['Elmer Rice'],True,True,True,[],['Germany'],['German'],False,True,True,,0,9.2,19,0.6,,False,,,False,False,,,False,False
152471,236001,Sleep Happy,Sleep Happy,en,1951-03-25,1951,True,False,"An exhausted Woody is walking the streets looking for a place to rest. He happens upon Wally Walrus' bed & board which welcomes boarders. He enters Wally's house, settles into bed, and sets his alarm. Unfortunately, Woody tends to be a noisy roommate with his constant snoring, chuckling, and moving about. Wally tries to silence him by all means possible but all attempts fail until, finally, the alarm goes off, the sun rises, a rested Woody leaves, and Wally has had one heck of a sleepless night.",,['animation'],,[],True,False,True,[],[],"['Walter Lantz', 'Dick Lundy']","['Heck Allen', 'Ben Hardaway']",False,True,True,"['Walter Lantz Productions', 'Universal Pictures']",[],['English'],True,False,True,6.8,5,6.5,129,0.6,7,True,,,False,False,https://image.tmdb.org/t/p/w500/bgZnQKAYll2MUEReP1dqLA4apQx.jpg,https://image.tmdb.org/t/p/w500/uAoccjQQxbELR7gwTcj1I1nhtah.jpg,True,True
35128,332914,The Suitors Club,Le club des soupirants,fr,1941-09-26,1941,True,False,"As playboys cannot pay their debts anymore,their creditors suggest one of them marry a millionaire's daughter.",,"['drama', 'comedy']",,[],True,False,True,"['Fernandel', 'Louise Carletti', 'Annie France', 'Colette Darfeuil', 'Saturnin Fabre', 'Andrex', 'Max Dearly', 'Marcel Vallee', 'Marguerite De Morlaye', 'Vanda Greville']","[4.882801922586371, 3.2188758248682006, 2.0794415416798357, 3.6375861597263857, 4.007333185232471, 3.8918202981106265, 2.5649493574615367, 3.7612001156935624, 2.0794415416798357, 2.302585092994046]",['Maurice Gleize'],"['Marcel Ayme', 'Andre Cayatte', 'Maurice Gleize', 'Jean Manse']",True,True,True,['other_company'],['France'],['French'],True,True,True,7.5,2,5.8,48,0.724,80,True,,,False,False,https://image.tmdb.org/t/p/w500/3G1vAZ3JizdFarJBjsY3yzLCJw.jpg,https://image.tmdb.org/t/p/w500/xFNd0dvHzH6rUH1xzIM0HJ6Bp6i.jpg,True,True
5614174,480657,No Gods No Masters,Ni dieux ni maîtres,fr,2020-02-11,2020,True,False,"The story unfolds in the winter of the year 1215. A mysterious stranger who has escaped from prison arrives in a tiny, remote village in the kingdom of France plagued by famine and leprosy, and ruled by an ageing lord, a former hero from the Crusades, Lord Ocam. Together with his horde of knights, Ocam abducts a young girl from the village in order to exert his droit du seigneur over her. A handful of villagers, backed up by The Stranger, attempt to release her, but they only have until nightfall…",,"['drama', 'adventure', 'history']",,[],True,False,True,"['Jenna Thiam', 'Edith Scob', 'Saleh Bakri', 'Jean-Claude Drouot', 'rare_actor', 'rare_actor', 'rare_actor', 'Pascal Greggory', 'Jerome Le Banner', 'rare_actor']","[2.5649493574615367, 4.204692619390966, 3.4965075614664802, 3.1780538303479458, 0.1, 0.1, 0.1, 4.276666119016055, 2.302585092994046, 0.1]",['Eric Cherriere'],['Eric Cherriere'],True,True,True,"['other_company', 'other_company', 'other_company']",['France'],['French'],True,True,True,,0,5.5,22,0.9,78,True,,,False,False,https://image.tmdb.org/t/p/w500/pGgjA55dG8g36Q52ewSWRG6fUGF.jpg,https://image.tmdb.org/t/p/w500/yt0INdlZBavhXvP7IylXydVTby8.jpg,True,True
5970960,469324,Charles Pathé et Léon Gaumont premiers géants du cinéma,Charles Pathé et Léon Gaumont premiers géants du cinéma,fr,2016-01-01,2016,True,False,,,['documentary'],,[],False,False,True,[],[],"['Emmanuelle Nobecourt', 'Gaelle Royer']","['Emmanuelle Nobecourt', 'Gaelle Royer']",False,True,True,[],[],['French'],False,False,True,7.3,3,7.9,60,0.7,50,True,,,False,False,https://image.tmdb.org/t/p/w500/g7UKjL10i4nAxhHHs4AtcMsFj7l.jpg,https://image.tmdb.org/t/p/w500/vhdVupENs4bC3zkuhm4ZgiEyKFA.jpg,True,True
13399534,1001789,Run,Run,en,2021-02-14,2021,True,False,"Jerome becomes a street cop in hopes to find his mother but also seeks love in the mist, that may turn into a tragedy.",,"['drama', 'crime', 'romance']",,[],True,False,True,"['rare_actor', 'Latoya Ward', 'rare_actor', 'rare_actor', 'rare_actor']","[0.1, 2.302585092994046, 0.1, 0.1, 0.1]",['Jahmar Hill'],['Jahmar Hill'],True,True,True,[],[],[],False,False,False,,0,4.7,49,1.479,89,True,,,False,False,https://image.tmdb.org/t/p/w500/7OacjDlPqhcmrA86ikvQfxrwzyl.jpg,,True,False
3737596,973333,The Common Linnets: Calm Before the Storm,The Common Linnets: Calm Before the Storm,nl,2014-04-16,2014,True,False,An intimate look at the working method of the two successful singer-songwriters Ilse DeLange and Waylon. We see the storm that erupts when it becomes known that The Common Linnets are participating in the Eurovision Song Contest.,,"['documentary', 'music']","country music, eurovision","['country music', 'eurovision']",True,False,True,"['rare_actor', 'rare_actor', 'rare_actor', 'rare_actor']","[0.1, 0.1, 0.1, 0.1]",[],[],True,False,False,[],['Netherlands'],"['Dutch', 'English']",False,True,True,,0,7.5,9,0.6,117,True,,,False,False,,,False,False
23099300,1037099,All I Didn't Want for Christmas,All I Didn't Want for Christmas,en,2022-12-07,2022,True,False,"Emily Harris is not doing great. In a desperate attempt to improve her life and make this Christmas not totally suck, Emily writes a letter to Santa. Fortunately, and unfortunately, her wine-soaked wishes start coming true.",,"['tv movie', 'comedy', 'romance']","christmas, christmas theme","['christmas', 'christmas theme']",True,False,True,"['Gabourey Sidibe', 'Kel Mitchell', 'Loretta Devine', 'Andrew Bushell', 'Karen Knox', 'Eugene Clark', 'David Pinard', 'Darrin Baker', 'Connie Wang', 'rare_actor']","[2.3978952727983707, 2.995732273553991, 4.406719247264253, 2.995732273553991, 1.791759469228055, 3.8712010109078907, 2.4849066497880004, 2.0794415416798357, 1.791759469228055, 0.1]",['rare_director'],"['rare_writer', 'rare_writer']",True,True,True,[],"['Canada', 'United States of America']",['English'],False,True,True,7.8,6,5.8,257,2.415,89,True,,,False,False,https://image.tmdb.org/t/p/w500/DDOeBtFRoZM31UuzQxLODROXMr.jpg,https://image.tmdb.org/t/p/w500/cfEl7n6Y6SD6CIW711PMivsZ1QV.jpg,True,True
476070,111403,A Song's Best Friend - John Denver Remembered,A Song's Best Friend - John Denver Remembered,en,2005-07-05,2005,True,False,"Close friends of John Denver and his first wife Annie remember the singer/ songwriter John Denver and his music. The interviewees tell personal stories about John Denver over a background of excerpts form his TV specials, films, concerts and home movies. The film also highlights John Denver's unwavering commitment to the environment, world peace and humanitarian causes",,"['documentary', 'music']",,[],True,False,True,['John Denver'],[3.295836866004329],['rare_director'],['rare_writer'],True,True,True,[],[],[],False,False,False,10.0,1,8.5,41,0.907,58,True,,,False,False,https://image.tmdb.org/t/p/w500/pP3CT5ehaLmH8PSGLRHbXudSThO.jpg,,True,False
888701,79366,It's Possible Your Heart Cannot Be Broken,你的心可能硬如坚石,zh,2005-01-01,2005,True,False,"In this black comedy about the disintegration of a love affair, a young woman's loneliness in the midst of Kuala Lumpur's metropolitan sprawl triggers a tenuous relationship with a naïve salesman who has a tendency to please and over-emote.",,[],,[],True,False,True,[],[],['Ming Jin Woo'],['Ming Jin Woo'],False,True,True,[],[],['Mandarin'],False,False,True,,0,6.6,11,0.6,15,True,315,,True,False,https://image.tmdb.org/t/p/w500/2OmIcnzYxZiWNFPIPIKlBn28ARN.jpg,,True,False
9168136,604077,Reggae Boyz,Reggae Boyz,de,2018-05-03,2018,True,False,"Plagued with poverty and violence, Jamaica tries to inspire its populace by qualifying their national team, the 'Reggae Boyz', for the World Cup. When their efforts start to fall short, Winnie Schäfer, a colorful German coach, teams up with reggae musicians to unite Jamaica beyond the soccer pitch.",,['documentary'],"jamaica, football (soccer)","['jamaica', 'football (soccer)']",True,False,True,[],[],['Till Schauder'],"['rare_writer', 'rare_writer', 'Till Schauder', 'rare_writer']",False,True,True,[],['Germany'],['German'],False,True,True,8.0,1,7.5,12,0.6,85,True,,,False,False,https://image.tmdb.org/t/p/w500/ypCABMI5KYczF8Dd1o0Vauedqq2.jpg,https://image.tmdb.org/t/p/w500/76TNlP01G2mMafnNwLITtZlaaGO.jpg,True,True
311977,627862,Viktor and his Brothers,Viktor och hans bröder,sv,2002-02-22,2002,True,False,"Viktor's family doesn't get along very well; his older brothers fight, his father is tired and broken, his mother despondent. Viktor does what he can to make things better.",,['drama'],short film,['short film'],True,False,True,"['Axel Zuber', 'Henrik Lundstrom', 'Christoffer Svensson', 'Ing-Marie Carlsson', 'rare_actor', 'Claes Ljungmark']","[1.791759469228055, 2.0794415416798357, 2.302585092994046, 3.4011973816621555, 0.1, 3.1780538303479458]",['Marten Klingberg'],"['Linn Gottfridsson', 'Daniel Karlsson']",True,True,True,[],[],['Swedish'],False,False,True,,0,7.9,52,0.888,31,True,,,False,False,,,False,False
3624422,366895,Wayward,Rodløs,da,2015-04-10,2015,True,False,"A coming-of-age story about a 14-year-old girl who works at a car mechanic's and hangs out with her friends. She challenges boundaries in her search for identity, but her behaviour has repercussions that force her to acknowledge new aspects of who she is.",,['drama'],"sexual abuse, trauma, sexual humiliation, woman director, short film","['sexual abuse', 'trauma', 'sexual humiliation', 'woman director', 'short film']",True,False,True,"['rare_actor', 'rare_actor', 'rare_actor', 'Anne Sofie Espersen', 'rare_actor', 'rare_actor', 'rare_actor', 'rare_actor', 'rare_actor', 'rare_actor']","[0.1, 0.1, 0.1, 2.302585092994046, 0.1, 0.1, 0.1, 0.1, 0.1, 0.1]",['Kira Richards Hansen'],['rare_writer'],True,True,True,['other_company'],['Denmark'],['Danish'],True,True,True,4.7,3,5.9,41,1.055,20,True,,,False,False,https://image.tmdb.org/t/p/w500/kzUbpfitWk5tzWTKawx5zaEq9vH.jpg,https://image.tmdb.org/t/p/w500/sSJpWJrcK6DZGC2iAOIWeZXrDh.jpg,True,True
